{
  "executiveControl": {
    "sol": 101,
    "cendPresent": true,
    "otherCards": []
  },
  "caseControl": {
    "subcases": [
      {
        "id": 1,
        "analysisType": "LinearStatic",
        "spc": "2",
        "load": "2"
      }
    ]
  },
  "bulkDataSummary": {
    "nodeCount": 22,
    "elementCountsByType": {
      "CQUAD4": 10
    },
    "materials": []
  },
  "fileSummary": {
    "inputFiles": [
      "test.bdf"
    ],
    "outputFiles": [],
    "sourceFileName": "test.bdf",
    "sourceFileStem": "test"
  }
}